"H. Rept. 115-369",https://www.congress.gov/congressional-report/115th-congress/house-report/369/1,"115th Congress (2017-2018)","H.Res. 580","PROVIDING FOR CONSIDERATION OF THE SENATE AMENDMENT TO THE CONCURRENT RESOLUTION (H. CON. RES. 71) ESTABLISHING THE CONGRESSIONAL BUDGET FOR THE UNITED STATES GOVERNMENT FOR FISCAL YEAR 2018 AND SETTING FORTH THE APPROPRIATE BUDGETARY LEVELS FOR FISCAL YEARS 2019 THROUGH 2027","House Rules"
"H. Rept. 115-368",https://www.congress.gov/congressional-report/115th-congress/house-report/368/1,"115th Congress (2017-2018)","H.R. 2600","TO PROVIDE FOR THE CONVEYANCE TO THE STATE OF IOWA OF THE REVERSIONARY INTEREST HELD BY THE UNITED STATES IN CERTAIN LAND IN POTTAWATTAMIE COUNTY, IOWA, AND FOR OTHER PURPOSES","House Natural Resources"
"H. Rept. 115-367",https://www.congress.gov/congressional-report/115th-congress/house-report/367/1,"115th Congress (2017-2018)","H.R. 3342","SANCTIONING HIZBALLAH'S ILLICIT USE OF CIVILIANS AS DEFENSELESS SHIELDS ACT","House Foreign Affairs"
"H. Rept. 115-366",https://www.congress.gov/congressional-report/115th-congress/house-report/366/1,"115th Congress (2017-2018)","H.R. 3329","HIZBALLAH INTERNATIONAL FINANCING PREVENTION AMENDMENTS ACT OF 2017","House Foreign Affairs"
"H. Rept. 115-365",https://www.congress.gov/congressional-report/115th-congress/house-report/365/1,"115th Congress (2017-2018)","H.R. 3279","HELIUM EXTRACTION ACT OF 2017","House Natural Resources"
"H. Rept. 115-364",https://www.congress.gov/congressional-report/115th-congress/house-report/364/1,"115th Congress (2017-2018)","H.Res. 555","RESOLUTION OF INQUIRY REQUESTING THE PRESIDENT AND DIRECTING THE SECRETARY OF THE INTERIOR TO TRANSMIT, RESPECTIVELY, CERTAIN DOCUMENTS AND OTHER INFORMATION TO THE HOUSE OF REPRESENTATIVES RELATING TO THE EXECUTIVE ORDER ON THE REVIEW OF DESIGNATIONS UNDER THE ANTIQUITIES ACT","House Natural Resources"
"H. Rept. 115-363",https://www.congress.gov/congressional-report/115th-congress/house-report/363/1,"115th Congress (2017-2018)","H.Res. 577","PROVIDING FOR CONSIDERATION OF THE BILL (H.R. 469) TO IMPOSE CERTAIN LIMITATIONS ON CONSENT DECREES AND SETTLEMENT AGREEMENTS BY AGENCIES THAT REQUIRE THE AGENCIES TO TAKE REGULATORY ACTION IN ACCORDANCE WITH THE TERMS THEREOF, AND FOR OTHER PURPOSES, AND PROVIDING FOR CONSIDERATION OF THE BILL (H.R. 732) TO LIMIT DONATIONS MADE PURSUANT TO SETTLEMENT AGREEMENTS TO WHICH THE UNITED STATES IS A PARTY, AND FOR OTHER PURPOSES","House Rules"
"H. Rept. 115-362",https://www.congress.gov/congressional-report/115th-congress/house-report/362/1,"115th Congress (2017-2018)","H.R. 3972","FAMILY OFFICE TECHNICAL CORRECTION ACT OF 2017","House Financial Services"
"H. Rept. 115-361",https://www.congress.gov/congressional-report/115th-congress/house-report/361/1,"115th Congress (2017-2018)","H.R. 3898","IMPEDING NORTH KOREA'S ACCESS TO FINANCE ACT OF 2017","House Financial Services"
"H. Rept. 115-360",https://www.congress.gov/congressional-report/115th-congress/house-report/360/1,"115th Congress (2017-2018)","H.R. 4010","CONGRESSIONAL SUBPOENA COMPLIANCE AND ENFORCEMENT ACT OF 2017","House Judiciary"
"H. Rept. 115-359",https://www.congress.gov/congressional-report/115th-congress/house-report/359/1,"115th Congress (2017-2018)","H.R. 3922","COMMUNITY HEALTH AND MEDICAL PROFESSIONALS IMPROVE OUR NATION ACT OF 2017","House Energy and Commerce"
"H. Rept. 115-358",https://www.congress.gov/congressional-report/115th-congress/house-report/358/1,"115th Congress (2017-2018)","H.R. 3921","HELPING ENSURE ACCESS FOR LITTLE ONES, TODDLERS, AND HOPEFUL YOUTH BY KEEPING INSURANCE DELIVERY STABLE ACT OF 2017","House Energy and Commerce"
"H. Rept. 115-357",https://www.congress.gov/congressional-report/115th-congress/house-report/357/1,"115th Congress (2017-2018)","H.R. 2921","NATIONAL FOREST SYSTEM VEGETATION MANAGEMENT PILOT PROGRAM ACT OF 2017","House Agriculture"
"H. Rept. 115-356",https://www.congress.gov/congressional-report/115th-congress/house-report/356/1,"115th Congress (2017-2018)","H.R. 3101","STRENGTHENING CYBERSECURITY INFORMATION SHARING AND COORDINATION IN OUR PORTS ACT OF 2017","House Homeland Security"
"H. Rept. 115-355",https://www.congress.gov/congressional-report/115th-congress/house-report/355/1,"115th Congress (2017-2018)","H.R. 3053","NUCLEAR WASTE POLICY AMENDMENTS ACT OF 2017","House Energy and Commerce"
"H. Rept. 115-354",https://www.congress.gov/congressional-report/115th-congress/house-report/354/1,"115th Congress (2017-2018)","H.R. 2410","SICKLE CELL DISEASE RESEARCH, SURVEILLANCE, PREVENTION, AND TREATMENT ACT OF 2017","House Energy and Commerce"
"H. Rept. 115-353",https://www.congress.gov/congressional-report/115th-congress/house-report/353/1,"115th Congress (2017-2018)","H.R. 2941","KISATCHIE NATIONAL FOREST LAND CONVEYANCE ACT","House Agriculture"
"H. Rept. 115-352",https://www.congress.gov/congressional-report/115th-congress/house-report/352/1,"115th Congress (2017-2018)","H.R. 2521","SOUTH CAROLINA PEANUT PARITY ACT OF 2017","House Agriculture"
"H. Rept. 115-351",https://www.congress.gov/congressional-report/115th-congress/house-report/351/1,"115th Congress (2017-2018)","H.R. 1731","REVITALIZING THE ECONOMY OF COAL COMMUNITIES BY LEVERAGING LOCAL ACTIVITIES AND INVESTING MORE ACT OF 2017","House Natural Resources"
"H. Rept. 115-350",https://www.congress.gov/congressional-report/115th-congress/house-report/350/1,"115th Congress (2017-2018)","H.R. 1488","THE INDIANA DUNES NATIONAL PARK ACT","House Natural Resources"
"H. Rept. 115-349",https://www.congress.gov/congressional-report/115th-congress/house-report/349/1,"115th Congress (2017-2018)","H.R. 1769","SAN LUIS UNIT DRAINAGE RESOLUTION ACT","House Natural Resources"
"H. Rept. 115-348",https://www.congress.gov/congressional-report/115th-congress/house-report/348/1,"115th Congress (2017-2018)","H.R. 1096","JUDGMENT FUND TRANSPARENCY ACT OF 2017","House Judiciary"
"H. Rept. 115-347",https://www.congress.gov/congressional-report/115th-congress/house-report/347/1,"115th Congress (2017-2018)","H.R. 469","SUNSHINE FOR REGULATIONS AND REGULATORY DECREES AND SETTLEMENTS ACT OF 2017","House Judiciary"
"H. Rept. 115-346",https://www.congress.gov/congressional-report/115th-congress/house-report/346/1,"115th Congress (2017-2018)","H.R. 3669","SECURING GENERAL AVIATION AND COMMERCIAL CHARTER AIR CARRIER SERVICE ACT OF 2017","House Homeland Security"
"H. Rept. 115-345",https://www.congress.gov/congressional-report/115th-congress/house-report/345/1,"115th Congress (2017-2018)","H.Res. 562","PROVIDING FOR CONSIDERATION OF THE BILL (S. 585) TO PROVIDE GREATER WHISTLEBLOWER PROTECTIONS FOR FEDERAL EMPLOYEES, INCREASED AWARENESS OF FEDERAL WHISTLEBLOWER PROTECTIONS, AND INCREASED ACCOUNTABILITY AND REQUIRED DISCIPLINE FOR FEDERAL SUPERVISORS WHO RETALIATE AGAINST WHISTLEBLOWERS, AND FOR OTHER PURPOSES; PROVIDING FOR PROCEEDINGS DURING THE PERIOD FROM OCTOBER 16, 2017, THROUGH OCTOBER 20, 2017; AND PROVIDING FOR CONSIDERATION OF MOTIONS TO SUSPEND THE RULES","House Rules"
"H. Rept. 115-344",https://www.congress.gov/congressional-report/115th-congress/house-report/344/1,"115th Congress (2017-2018)","H.R. 3243","FITARA ENHANCEMENT ACT OF 2017","House Oversight and Government Reform"
"H. Rept. 115-343",https://www.congress.gov/congressional-report/115th-congress/house-report/343/1,"115th Congress (2017-2018)","H.R. 3031","TSP MODERNIZATION ACT OF 2017","House Oversight and Government Reform"
"H. Rept. 115-342",https://www.congress.gov/congressional-report/115th-congress/house-report/342/1,"115th Congress (2017-2018)","H.R. 2196","TO AMEND TITLE 5, UNITED STATES CODE, TO ALLOW WHISTLEBLOWERS TO DISCLOSE INFORMATION TO CERTAIN RECIPIENTS","House Oversight and Government Reform"
"H. Rept. 115-341",https://www.congress.gov/congressional-report/115th-congress/house-report/341/1,"115th Congress (2017-2018)","H.R. 378","BONUSES FOR COST-CUTTERS ACT OF 2017","House Oversight and Government Reform"
"H. Rept. 115-340",https://www.congress.gov/congressional-report/115th-congress/house-report/340/1,"115th Congress (2017-2018)","H.R. 2989","FREDERICK DOUGLASS BICENTENNIAL COMMISSION ACT","House Oversight and Government Reform"
"H. Rept. 115-339",https://www.congress.gov/congressional-report/115th-congress/house-report/339/1,"115th Congress (2017-2018)","H.Res. 553","PROVIDING FOR CONSIDERATION OF THE CONCURRENT RESOLUTION (H. CON. RES. 71) ESTABLISHING THE CONGRESSIONAL BUDGET FOR THE UNITED STATES GOVERNMENT FOR FISCAL YEAR 2018 AND SETTING FORTH THE APPROPRIATE BUDGETARY LEVELS FOR FISCAL YEARS 2019 THROUGH 2027","House Rules"
"H. Rept. 115-338",https://www.congress.gov/congressional-report/115th-congress/house-report/338/1,"115th Congress (2017-2018)","H.Res. 548","PROVIDING FOR CONSIDERATION OF THE BILL (H.R. 36) TO AMEND TITLE 18, UNITED STATES CODE, TO PROTECT PAIN-CAPABLE UNBORN CHILDREN, AND FOR OTHER PURPOSES","House Rules"
"H. Rept. 115-337",https://www.congress.gov/congressional-report/115th-congress/house-report/337/1,"115th Congress (2017-2018)",,"ALL CIRCUIT REVIEW ACT","House Oversight and Government Reform"
"H. Rept. 115-336",https://www.congress.gov/congressional-report/115th-congress/house-report/336/1,"115th Congress (2017-2018)","H.R. 1107","PERSHING COUNTY ECONOMIC DEVELOPMENT AND CONSERVATION ACT","House Natural Resources"
"H. Rept. 115-335",https://www.congress.gov/congressional-report/115th-congress/house-report/335/1,"115th Congress (2017-2018)","H.Res. 488","RESOLUTION OF INQUIRY REQUESTING THE PRESIDENT AND DIRECTING THE ATTORNEY GENERAL TO TRANSMIT, RESPECTIVELY, CERTAIN DOCUMENTS TO THE HOUSE OF REPRESENTATIVES RELATING TO THE REMOVAL OF FORMER FEDERAL BUREAU OF INVESTIGATION DIRECTOR JAMES COMEY","House Judiciary"
"H. Rept. 115-334",https://www.congress.gov/congressional-report/115th-congress/house-report/334/1,"115th Congress (2017-2018)","H.R. 3281","RECLAMATION TITLE TRANSFER AND NON-FEDERAL INFRASTRUCTURE INCENTIVIZATION ACT","House Natural Resources"
"H. Rept. 115-333",https://www.congress.gov/congressional-report/115th-congress/house-report/333/1,"115th Congress (2017-2018)","H.Res. 538","PROVIDING FOR CONSIDERATION OF THE BILL (H.R. 3823) TO AMEND TITLE 49, UNITED STATES CODE, TO EXTEND AUTHORIZATIONS FOR THE AIRPORT IMPROVEMENT PROGRAM, TO AMEND THE INTERNAL REVENUE CODE OF 1986 TO EXTEND THE FUNDING AND EXPENDITURE AUTHORITY OF THE AIRPORT AND AIRWAY TRUST FUND, TO PROVIDE DISASTER TAX RELIEF, AND FOR OTHER PURPOSES, AND PROVIDING FOR CONSIDERATION OF MOTIONS TO SUSPEND THE RULES","House Rules"
"H. Rept. 115-332",https://www.congress.gov/congressional-report/115th-congress/house-report/332/1,"115th Congress (2017-2018)","H.R. 3229","TO PROTECT THE SAFETY OF JUDGES BY EXTENDING THE AUTHORITY OF THE JUDICIAL CONFERENCE TO REDACT SENSITIVE INFORMATION CONTAINED IN THEIR FINANCIAL DISCLOSURE REPORTS, AND FOR OTHER PURPOSES","House Judiciary"
"H. Rept. 115-331",https://www.congress.gov/congressional-report/115th-congress/house-report/331/1,"115th Congress (2017-2018)","H.Res. 533","PROVIDING FOR CONSIDERATION OF THE BILL (H.R. 2824) TO AMEND TITLE V OF THE SOCIAL SECURITY ACT TO EXTEND THE MATERNAL, INFANT, AND EARLY CHILDHOOD HOME VISITING PROGRAM; PROVIDING FOR CONSIDERATION OF THE BILL (H.R. 2792) TO AMEND THE SOCIAL SECURITY ACT TO MAKE CERTAIN REVISIONS TO PROVISIONS LIMITING PAYMENT OF BENEFITS TO FUGITIVE FELONS UNDER TITLES II, VIII, AND XVI OF THE SOCIAL SECURITY ACT; AND FOR OTHER PURPOSES","House Rules"
"H. Rept. 115-330",https://www.congress.gov/congressional-report/115th-congress/house-report/330/1,"115th Congress (2017-2018)","H.R. 880","MILITARY INJURY SURGICAL SYSTEMS INTEGRATED OPERATIONALLY NATIONWIDE TO ACHIEVE ZERO PREVENTABLE DEATHS ACT","House Energy and Commerce"
"H. Rept. 115-329",https://www.congress.gov/congressional-report/115th-congress/house-report/329/1,"115th Congress (2017-2018)","H.R. 1222","CONGENITAL HEART FUTURES REAUTHORIZATION ACT OF 2017","House Energy and Commerce"
"H. Rept. 115-328",https://www.congress.gov/congressional-report/115th-congress/house-report/328/1,"115th Congress (2017-2018)","H.R. 2422","ACTION FOR DENTAL HEALTH ACT OF 2017","House Energy and Commerce"
"H. Rept. 115-327",https://www.congress.gov/congressional-report/115th-congress/house-report/327/1,"115th Congress (2017-2018)","H.R. 767","SOAR TO HEALTH AND WELLNESS ACT OF 2017","House Energy and Commerce"
"H. Rept. 115-326",https://www.congress.gov/congressional-report/115th-congress/house-report/326/1,"115th Congress (2017-2018)","H.R. 2776","WORKFORCE DEMOCRACY AND FAIRNESS ACT","House Education and the Workforce"
"H. Rept. 115-325",https://www.congress.gov/congressional-report/115th-congress/house-report/325/1,"115th Congress (2017-2018)","H.R. 2775","EMPLOYEE PRIVACY PROTECTION ACT","House Education and the Workforce"
"H. Rept. 115-324",https://www.congress.gov/congressional-report/115th-congress/house-report/324/1,"115th Congress (2017-2018)","H.R. 986","TRIBAL LABOR SOVEREIGNTY ACT OF 2017","House Education and the Workforce"
"H. Rept. 115-323",https://www.congress.gov/congressional-report/115th-congress/house-report/323/1,"115th Congress (2017-2018)","H.R. 3551","C-TPAT REAUTHORIZATION ACT OF 2017","House Homeland Security"
"H. Rept. 115-322",https://www.congress.gov/congressional-report/115th-congress/house-report/322/1,"115th Congress (2017-2018)","H.R. 2199","FEDERAL LAND ASSET INVENTORY REFORM ACT OF 2017","House Natural Resources"
"H. Rept. 115-321",https://www.congress.gov/congressional-report/115th-congress/house-report/321/1,"115th Congress (2017-2018)","H.R. 825","PUBLIC LAND RENEWABLE ENERGY DEVELOPMENT ACT OF 2017","House Natural Resources"
"H. Rept. 115-320",https://www.congress.gov/congressional-report/115th-congress/house-report/320/1,"115th Congress (2017-2018)","H.R. 289","GUIDES AND OUTFITTERS ACT","House Natural Resources"
"H. Rept. 115-319",https://www.congress.gov/congressional-report/115th-congress/house-report/319/1,"115th Congress (2017-2018)","H.R. 1491","SANTA YNEZ BAND OF CHUMASH INDIANS LAND AFFIRMATION ACT OF 2017","House Natural Resources"
"H. Rept. 115-318",https://www.congress.gov/congressional-report/115th-congress/house-report/318/1,"115th Congress (2017-2018)","H.R. 24","FEDERAL RESERVE TRANSPARENCY ACT OF 2017","House Oversight and Government Reform"
"H. Rept. 115-317",https://www.congress.gov/congressional-report/115th-congress/house-report/317/1,"115th Congress (2017-2018)","H.R. 2142","INTERNATIONAL NARCOTICS TRAFFICKING EMERGENCY RESPONSE BY DETECTING INCOMING CONTRABAND WITH TECHNOLOGY ACT","House Homeland Security"
"H. Rept. 115-316",https://www.congress.gov/congressional-report/115th-congress/house-report/316/1,"115th Congress (2017-2018)","H.R. 2792","CONTROL UNLAWFUL FUGITIVE FELONS ACT OF 2017","House Ways and Means"
"H. Rept. 115-315",https://www.congress.gov/congressional-report/115th-congress/house-report/315/2,"115th Congress (2017-2018)","H.R. 2824","INCREASING OPPORTUNITY AND SUCCESS FOR CHILDREN AND PARENTS THROUGH EVIDENCE-BASED HOME VISITING ACT","House Ways and Means"
"H. Rept. 115-315",https://www.congress.gov/congressional-report/115th-congress/house-report/315/1,"115th Congress (2017-2018)","H.R. 2824","INCREASING OPPORTUNITY AND SUCCESS FOR CHILDREN AND PARENTS THROUGH EVIDENCE-BASED HOME VISITING ACT","House Ways and Means"
"H. Rept. 115-314",https://www.congress.gov/congressional-report/115th-congress/house-report/314/1,"115th Congress (2017-2018)","H.R. 3668","SPORTSMEN'S HERITAGE AND RECREATIONAL ENHANCEMENT ACT","House Natural Resources"
"H. Rept. 115-313,Part 2",https://www.congress.gov/congressional-report/115th-congress/house-report/313/2,"115th Congress (2017-2018)","H.R. 2763","SMALL BUSINESS INNOVATION RESEARCH AND SMALL BUSINESS TECHNOLOGY TRANSFER IMPROVEMENTS ACT OF 2017","House Science, Space, and Technology"
"H. Rept. 115-313,Part 1",https://www.congress.gov/congressional-report/115th-congress/house-report/313/1,"115th Congress (2017-2018)","H.R. 2763","SMALL BUSINESS INNOVATION RESEARCH AND SMALL BUSINESS TECHNOLOGY TRANSFER IMPROVEMENTS ACT OF 2017","House Small Business"
"H. Rept. 115-312",https://www.congress.gov/congressional-report/115th-congress/house-report/312/1,"115th Congress (2017-2018)","H.R. 2423","WASHINGTON COUNTY, UTAH, PUBLIC LANDS MANAGEMENT IMPLEMENTATION ACT","House Natural Resources"
"H. Rept. 115-311",https://www.congress.gov/congressional-report/115th-congress/house-report/311/1,"115th Congress (2017-2018)","H.R. 2374","EASTERN NEVADA ECONOMIC DEVELOPMENT AND LAND MANAGEMENT IMPROVEMENT ACT","House Natural Resources"
"H. Rept. 115-310",https://www.congress.gov/congressional-report/115th-congress/house-report/310/1,"115th Congress (2017-2018)",,"IN THE MATTER OF ALLEGATIONS RELATING TO REPRESENTATIVE LUIS V. GUTIERREZ","House Ethics"
"H. Rept. 115-309",https://www.congress.gov/congressional-report/115th-congress/house-report/309/1,"115th Congress (2017-2018)","H.Res. 479","RESOLUTION OF INQUIRY DIRECTING THE SECRETARY OF THE TREASURY TO PROVIDE TO THE HOUSE OF REPRESENTATIVES THE TAX RETURN INFORMATION OF PRESIDENT DONALD J. TRUMP AS WELL AS THE TAX RETURNS OF EACH BUSINESS ENTITY DISCLOSED BY DONALD J. TRUMP ON HIS OFFICE OF GOVERNMENT ETHICS FORM 278E","House Ways and Means"
"H. Rept. 115-308",https://www.congress.gov/congressional-report/115th-congress/house-report/308/1,"115th Congress (2017-2018)","H.R. 3328","CUBAN AIRPORT SECURITY ACT OF 2017","House Homeland Security"
"H. Rept. 115-307",https://www.congress.gov/congressional-report/115th-congress/house-report/307/1,"115th Congress (2017-2018)","H.Res. 513","PROVIDING FOR CONSIDERATION OF THE BILL (H.R. 3697) TO AMEND THE IMMIGRATION AND NATIONALITY ACT WITH RESPECT TO ALIENS ASSOCIATED WITH CRIMINAL GANGS, AND FOR OTHER PURPOSES, AND PROVIDING FOR PROCEEDINGS DURING THE PERIOD FROM SEPTEMBER 15, 2017, THROUGH SEPTEMBER 22, 2017","House Rules"
"H. Rept. 115-306",https://www.congress.gov/congressional-report/115th-congress/house-report/306/1,"115th Congress (2017-2018)","H.R. 1624","MUNICIPAL FINANCE SUPPORT ACT OF 2017","House Financial Services"
"H. Rept. 115-305",https://www.congress.gov/congressional-report/115th-congress/house-report/305/1,"115th Congress (2017-2018)","H.R. 2582","CONFIRMING STATE LAND GRANTS FOR EDUCATION ACT","House Natural Resources"
"H. Rept. 115-304",https://www.congress.gov/congressional-report/115th-congress/house-report/304/1,"115th Congress (2017-2018)","H.R. 2874","21ST CENTURY FLOOD REFORM ACT","House Financial Services"
"H. Rept. 115-303",https://www.congress.gov/congressional-report/115th-congress/house-report/303/1,"115th Congress (2017-2018)","H.R. 3017","BROWNFIELDS ENHANCEMENT, ECONOMIC REDEVELOPMENT, AND REAUTHORIZATION ACT OF 2017","House Energy and Commerce"
"H. Rept. 115-302",https://www.congress.gov/congressional-report/115th-congress/house-report/302/1,"115th Congress (2017-2018)","H.R. 2615","GULF ISLANDS NATIONAL SEASHORE LAND EXCHANGE ACT OF 2017","House Natural Resources"
"H. Rept. 115-301",https://www.congress.gov/congressional-report/115th-congress/house-report/301/1,"115th Congress (2017-2018)","H.R. 931","FIREFIGHTER CANCER REGISTRY ACT OF 2017","House Energy and Commerce"
"H. Rept. 115-300",https://www.congress.gov/congressional-report/115th-congress/house-report/300/1,"115th Congress (2017-2018)","H.Res. 446","RESOLUTION OF INQUIRY REQUESTING THE PRESIDENT AND DIRECTING THE ATTORNEY GENERAL TO TRANSMIT, RESPECTIVELY, CERTAIN DOCUMENTS TO THE HOUSE OF REPRESENTATIVES RELATING TO THE REMOVAL OF FORMER FEDERAL BUREAU OF INVESTIGATION DIRECTOR JAMES COMEY","House Judiciary"
"H. Rept. 115-299",https://www.congress.gov/congressional-report/115th-congress/house-report/299/1,"115th Congress (2017-2018)","H.Res. 509","PROVIDING FOR CONSIDERATION OF THE SENATE AMENDMENT TO THE HOUSE AMENDMENT TO THE SENATE AMENDMENT TO THE BILL (H.R. 601) TO ENHANCE THE TRANSPARENCY AND ACCELERATE THE IMPACT OF ASSISTANCE PROVIDED UNDER THE FOREIGN ASSISTANCE ACT OF 1961 TO PROMOTE QUALITY BASIC EDUCATION IN DEVELOPING COUNTRIES, TO BETTER ENABLE SUCH COUNTRIES TO ACHIEVE UNIVERSAL ACCESS TO QUALITY BASIC EDUCATION AND IMPROVED LEARNING OUTCOMES, TO ELIMINATE DUPLICATION AND WASTE, AND FOR OTHER PURPOSES","House Rules"
"H. Rept. 115-298",https://www.congress.gov/congressional-report/115th-congress/house-report/298/1,"115th Congress (2017-2018)","H.R. 3326","WORLD BANK ACCOUNTABILITY ACT OF 2017","House Financial Services"
"H. Rept. 115-297",https://www.congress.gov/congressional-report/115th-congress/house-report/297/1,"115th Congress (2017-2018)","H.Res. 504","PROVIDING FOR FURTHER CONSIDERATION OF THE BILL (H.R. 3354) MAKING APPROPRIATIONS FOR THE DEPARTMENT OF THE INTERIOR, ENVIRONMENT, AND RELATED AGENCIES FOR THE FISCAL YEAR ENDING SEPTEMBER 30, 2018, AND FOR OTHER PURPOSES","House Rules"
"H. Rept. 115-296",https://www.congress.gov/congressional-report/115th-congress/house-report/296/1,"115th Congress (2017-2018)","H.R. 2997","21ST CENTURY AVIATION INNOVATION, REFORM, AND REAUTHORIZATION ACT","House Transportation and Infrastructure"
"H. Rept. 115-295",https://www.congress.gov/congressional-report/115th-congress/house-report/295/1,"115th Congress (2017-2018)","H.Res. 500","PROVIDING FOR CONSIDERATION OF THE BILL (H.R. 3354) MAKING APPROPRIATIONS FOR THE DEPARTMENT OF THE INTERIOR, ENVIRONMENT, AND RELATED AGENCIES FOR THE FISCAL YEAR ENDING SEPTEMBER 30, 2018, AND FOR OTHER PURPOSES; PROVIDING FOR CONSIDERATION OF MOTIONS TO SUSPEND THE RULES; AND WAIVING A REQUIREMENT OF CLAUSE 6(A) OF RULE XIII WITH RESPECT TO CONSIDERATION OF CERTAIN RESOLUTIONS REPORTED FROM THE COMMITTEE ON RULES","House Rules"
"H. Rept. 115-294",https://www.congress.gov/congressional-report/115th-congress/house-report/294/1,"115th Congress (2017-2018)","H.R. 3388","SAFELY ENSURING LIVES FUTURE DEPLOYMENT AND RESEARCH IN VEHICLE EVOLUTION ACT","House Energy and Commerce"
"H. Rept. 115-293",https://www.congress.gov/congressional-report/115th-congress/house-report/293/1,"115th Congress (2017-2018)","H.R. 3110","FINANCIAL STABILITY OVERSIGHT COUNCIL INSURANCE MEMBER CONTINUITY ACT","House Financial Services"
"H. Rept. 115-292",https://www.congress.gov/congressional-report/115th-congress/house-report/292/1,"115th Congress (2017-2018)","H.R. 2864","TO DIRECT THE SECURITIES AND EXCHANGE COMMISSION TO ALLOW CERTAIN ISSUERS TO BE EXEMPT FROM REGISTRATION REQUIREMENTS, AND FOR OTHER PURPOSES","House Financial Services"
"H. Rept. 115-291",https://www.congress.gov/congressional-report/115th-congress/house-report/291/1,"115th Congress (2017-2018)","H.R. 2768","FOWLER AND BOSKOFF PEAKS DESIGNATION ACT","House Natural Resources"
"H. Rept. 115-290",https://www.congress.gov/congressional-report/115th-congress/house-report/290/1,"115th Congress (2017-2018)","H.R. 2611","LITTLE ROCK CENTRAL HIGH SCHOOL NATIONAL HISTORIC SITE BOUNDARY MODIFICATION ACT","House Natural Resources"
"H. Rept. 115-289",https://www.congress.gov/congressional-report/115th-congress/house-report/289/1,"115th Congress (2017-2018)","H.R. 2083","ENDANGERED SALMON AND FISHERIES PREDATION PREVENTION ACT","House Natural Resources"
"H. Rept. 115-288",https://www.congress.gov/congressional-report/115th-congress/house-report/288/1,"115th Congress (2017-2018)","H.R. 2316","COOPERATIVE MANAGEMENT OF MINERAL RIGHTS ACT OF 2017","House Natural Resources"
"H. Rept. 115-287",https://www.congress.gov/congressional-report/115th-congress/house-report/287/1,"115th Congress (2017-2018)","H.R. 3115","SUPERIOR NATIONAL FOREST LAND EXCHANGE ACT OF 2017","House Natural Resources"
"H. Rept. 115-286",https://www.congress.gov/congressional-report/115th-congress/house-report/286/1,"115th Congress (2017-2018)","H.R. 1843","RESTRAINING EXCESSIVE SEIZURE OF PROPERTY THROUGH THE EXPLOITATION OF CIVIL ASSET FORFEITURE TOOLS ACT","House Ways and Means"
"H. Rept. 115-285",https://www.congress.gov/congressional-report/115th-congress/house-report/285/1,"115th Congress (2017-2018)","H.Con.Res. 69","AUTHORIZING THE USE OF THE CAPITOL GROUNDS FOR THE DISTRICT OF COLUMBIA SPECIAL OLYMPICS LAW ENFORCEMENT TORCH RUN","House Transportation and Infrastructure"
"H. Rept. 115-284",https://www.congress.gov/congressional-report/115th-congress/house-report/284/1,"115th Congress (2017-2018)","H.R. 3284","JOINT COUNTERTERRORISM AWARENESS WORKSHOP SERIES ACT OF 2017","House Homeland Security"
"H. Rept. 115-283",https://www.congress.gov/congressional-report/115th-congress/house-report/283/1,"115th Congress (2017-2018)","H.R. 3202","CYBER VULNERABILITY DISCLOSURE REPORTING ACT","House Homeland Security"
"H. Rept. 115-282",https://www.congress.gov/congressional-report/115th-congress/house-report/282/1,"115th Congress (2017-2018)","H.R. 2371","WESTERN AREA POWER ADMINISTRATION TRANSPARENCY ACT","House Natural Resources"
"H. Rept. 115-281",https://www.congress.gov/congressional-report/115th-congress/house-report/281/1,"115th Congress (2017-2018)","H.R. 2075","CROOKED RIVER RANCH FIRE PROTECTION ACT","House Natural Resources"
"H. Rept. 115-280",https://www.congress.gov/congressional-report/115th-congress/house-report/280/1,"115th Congress (2017-2018)","H.R. 1547","UDALL PARK LAND EXCHANGE COMPLETION ACT","House Natural Resources"
"H. Rept. 115-279",https://www.congress.gov/congressional-report/115th-congress/house-report/279/1,"115th Congress (2017-2018)","H.R. 1074","TO REPEAL THE ACT ENTITLED ``AN ACT TO CONFER JURISDICTION ON THE STATE OF IOWA OVER OFFENSES COMMITTED BY OR AGAINST INDIANS ON THE SAC AND FOX INDIAN RESERVATION''","House Natural Resources"
"H. Rept. 115-278",https://www.congress.gov/congressional-report/115th-congress/house-report/278/1,"115th Congress (2017-2018)","H.R. 1807","PUBLIC WATER SUPPLY INVASIVE SPECIES COMPLIANCE ACT OF 2017","House Natural Resources"
